url,title,summary
https://sinosphere.blogs.nytimes.com/2013/10/28/gaming-chinas-art-market-with-expert-forgeries/,Gaming China’s Art Market With Expert Forgeries,"Hundreds, perhaps thousands, of workshops in China are producing replicas of ancient relics and artifacts, some good enough to fool connoisseurs and sell at Chinese auction houses."
https://www.nytimes.com/2006/10/14/nyregion/14mbrfs-003.html,Manhattan: Software Piracy Charges,"Three men accused of selling pirated software programs they advertised on Craigslist have been charged with criminal copyright infringement, Michael J. Garcia, the United States attorney in Manhattan, said yesterday. The three men  Riddi Bajracha..."
https://www.nytimes.com/2020/02/19/us/mgm-data-breach.html,MGM Resorts Says Data Breach Exposed Some Guests’ Personal Information,"The casino and hotel giant said “it was confident that no financial, payment card or password data was involved in this matter.”"
https://www.nytimes.com/2003/07/27/nyregion/briefs-government-guilty-plea-in-asbury-park.html,GUILTY PLEA IN ASBURY PARK,"Former councilman James Condos pleads guilty to federal mail fraud charges in connection with extensive bribery and corruption investigation in Asbury Park and Ocean Township, NJ; says he accepted $25,000 liquor license and nearly $15,000 in cash ..."
https://www.nytimes.com/2014/07/03/technology/cybercrime-scheme-aims-at-payments-in-brazil.html,Cybercrime Scheme Uncovered in Brazil,"Researchers say transactions worth $3.75 billion were compromised, though it is not clear how much was stolen."
https://www.nytimes.com/2018/07/03/business/dealbook/fraud-sec-false-statements.html,Are False Statements Enough to Prove Fraud?,The Supreme Court will take up that issue of whether false statements are enough to prove a scheme to defraud later this year.
https://www.nytimes.com/2001/03/01/world/money-laundering-report-gives-argentine-leader-a-new-woe.html,Money-Laundering Report Gives Argentine Leader a New Woe,"Argentina Pres Fernando de la Rua, who has had series of political setbacks, must now confront report from Washington about several Argentine financial insitutions laundering money from drug dealing and bribery; senior members of de la Rua's coali..."
https://bits.blogs.nytimes.com/2014/09/18/home-depot-says-data-from-56-million-cards-taken-in-breach/,Home Depot Says Data From 56 Million Cards Was Taken in Breach,"Home Depot confirmed on Thursday that 56 million cardholders’ account information had been compromised in a five-month cyberattack, making the breach the largest known attack on a retailer."
https://dealbook.nytimes.com/2012/02/28/grand-jury-is-convened-in-mf-global-case/,Grand Jury Convened in MF Global Case,"Federal prosecutors in Chicago convened a grand jury last year to investigate potential wrongdoing surrounding the collapse of MF Global, the commodities firm once run by Jon S. Corzine, according to a regulatory filing."
https://www.nytimes.com/2000/06/04/nyregion/for-money-laundering-bill-backers-cite-cases-from-past.html,"For Money-Laundering Bill, Backers Cite Cases From Past","Prosecutors cite cases to show need for broader New York law against money laundering law proposed by Gov George E Pataki; bill, strongly backed by federal and state law enforcement authorities and some powerful state legislators, would expand def..."
https://www.nytimes.com/2002/08/27/business/creditors-sue-ex-enron-official-for-12-million.html,Creditors Sue Ex-Enron Official for $12 Million,"Creditors for Enron file suit against former finance executive Michael J Kopper, seeking $12 million he agreed to turn over to government as part of plea deal; creditors says cash should be transferred to estate of company, not to government; argu..."
https://www.nytimes.com/2007/11/22/arts/design/22arts-MUSEUMOFFICI_BRF.html,Museum Official Charged With Theft,"The former chief financial officer of the Bellevue Arts Museum in Washington State has been charged with embezzling $300,000."
https://dealbook.nytimes.com/2011/04/15/bank-of-americas-legal-woes/,Bank of America’s Legal Woes,Bank of America’s quarterly earnings release barely mentioned the financial firm’s legal woes. But that doesn’t mean they’re not a drag on profits.
https://www.nytimes.com/2011/02/01/nyregion/01fraud.html,U.S. Charges Fraud Scheme by 2 Fake Guggenheims and One Fake Countess,The allegations in Manhattan federal court involved people who falsely claimed to be members of the Guggenheim family trying to insinuate themselves with both former President Bushes in hopes of making financial deals.
https://takingnote.blogs.nytimes.com/2013/08/02/another-scapegoat-goes-down/,A Wall Street Scapegoat Goes Down,A jury found Goldman’s Fabrice Tourre liable for civil fraud charges. But higher-level executives have escaped prosecution.
https://dealbook.nytimes.com/2011/10/12/u-s-tax-evasion-case-touches-julius-baer/,U.S. Tax Evasion Case Touches Julius Baer,"A tax evasion investigation in the United States has ensnared Julius Baer, a spokesman for the Swiss lender confirmed Wednesday, a day after the government charged two of the bank’s advisers with conspiring to help clients evade taxes on more than..."
https://www.nytimes.com/2004/08/18/world/world-briefing-americas-brazil-crackdown-on-money-laundering.html,World Briefing | Americas: Brazil: Crackdown On Money Laundering,"Brazilian police, as part of nationwide crackdown on money laundering and black-market currency, arrest infamous currency dealer Antonio de Oliveira Claramunt in Sao Paulo; Claramunt is accused of sending $500 million abroad from 1996 to 2002 (S)"
https://www.nytimes.com/2005/02/05/world/europe/greek-church-struggles-to-quell-raft-of-scandals-involving.html,Greek Church Struggles to Quell Raft of Scandals Involving Clergy,"Metropolitan Panteleimon of Attica, Greece, is suspended for six months as investigation proceeds into accusations that he embezzled $2.9 million and tried to rig court case in which he was fighting for control of monastery; Greece's top Orthodox ..."
https://www.nytimes.com/2015/07/23/business/dealbook/banamex-usa-fined-for-lack-of-safeguards-against-money-laundering.html,Banamex USA Fined for Lack of Safeguards Against Money Laundering,"Federal and state regulators said the bank, a unit of Citigroup, did not have adequate controls to detect illicit financial transactions."
https://dealbook.nytimes.com/2010/12/20/prospect-of-wikileaks-dump-poses-problems-for-regulators/,Prospect of WikiLeaks Dump Poses Problems for Regulators,"Julian Assange, the founder of WikiLeaks, has said his organization has damaging information about a major bank — a prospect that may be more nerve-racking for regulators in Washington."
https://www.nytimes.com/2007/06/08/washington/08cnd-jeff.html,Congressman Pleads Not Guilty to Bribery,Representative William Jefferson was charged with soliciting hundreds of thousands of dollars in bribes.
https://www.nytimes.com/2008/12/26/business/26views.html,Ignominious Seven From 2008,Seven tales of financial wheezes people thought were a good idea during the preceding bull market.
https://www.nytimes.com/2018/03/14/business/equifax-executive-insider-trading.html,Ex-Equifax Executive Charged With Insider Trading Tied to ’17 Breach,"Jun Ying, a former top technology official at the consumer credit reporting agency, sold nearly $1 million in shares before the public was told of a major data breach, the S.E.C. said in a complaint."
https://dealbook.nytimes.com/2014/01/27/two-executives-of-bitcoin-businesses-are-arrested/,Bitcoin Figure Is Accused of Conspiring to Launder Money,"One of the most prominent players in the Bitcoin universe, Charles Shrem, was arrested on Sunday, accused of conspiring to facilitate drug transactions on the now-defunct online bazaar Silk Road."
https://dealbook.nytimes.com/2010/01/04/credit-suisse-accused-of-defrauding-resort-investors/,Credit Suisse Accused of Defrauding Resort Investors,"Credit Suisse has been sued for $24 billion by property owners who contend that the Swiss bank schemed to defraud investors in several resort communities, including the bankrupted Yellowstone Club."
https://www.nytimes.com/2010/08/04/nyregion/04salander.html,Art Dealer Is Sentenced for $120 Million Scheme,Lawrence B. Salander will serve 6 to 18 years in prison for stealing money and artwork.
https://www.nytimes.com/2017/04/07/opinion/offshore-money-bane-of-democracy.html,"Offshore Money, Bane of Democracy","Greedy rulers around the world steal billions, disguise it and stash it in the West."
https://www.nytimes.com/2007/01/18/nyregion/18mbrfs-couple.html,Trenton: Couple Accused of Money Laundering,"A New York couple were arrested yesterday and charged with money laundering and receiving stolen property for using slot machines in Atlantic City to launder embezzled money, said Stuart Rabner, the New Jersey attorney general. The woman, Jamine A..."
https://www.nytimes.com/2000/04/21/business/russian-banks-hold-enigmas-within-mazes-us-tries-follow-path-suspected.html,Russian Banks Hold Enigmas Within Mazes; U.S. Tries to Follow Path Of Suspected Wrongdoing,"American prosecutors seek to untangle maze involving billions of dollars that slipped out of Russian banking industry from 1996 to 1999 in alleged tax-dodging and money-laundering scheme that resulted in some criminal charges, including those agai..."
https://www.nytimes.com/2016/07/28/nyregion/a-veteran-living-in-squalor-and-allegations-of-staggering-abuse.html,"A Veteran Living in Squalor, and Allegations of ‘Staggering’ Abuse","The authorities say David McLellan was exploited for years by another man at a motel in Orange County who posed as his caretaker, withheld food and stole thousands of dollars."
https://www.nytimes.com/2016/12/21/arts/design/prominent-antiquities-dealer-accused-of-selling-stolen-artifacts.html,Prominent Antiquities Dealer Accused of Selling Stolen Artifacts,Prosecutors say Nancy Weiner obtained millions of dollars in stolen artifacts from international smugglers and sold them illegally.
https://dealbook.nytimes.com/2007/03/29/regulators-seek-210-million-penalty-from-txu/,Regulators Seek $210 Million Penalty From TXU,"Texas state regulators are demanding $210 million in fines from the energy company TXU for allegedly manipulating the wholesale power market in 2005. It would mark the largest penalty ever proposed by the Texas Public Utility Commission’s staff. TXU, which is currently the subject of a $45 billion buyout proposal, called the accusations “flatly wrong” and said it planned to contest the findings. "
https://www.nytimes.com/2007/05/08/opinion/08tue3.html,Congress and the Student Loan Scam,Recent revelations have shown just how corrupt and costly the student loan business has become.
https://dealbook.blogs.nytimes.com/2009/06/29/blogs/29dealbook-white-co81381.html,White-Collar Jail Terms: Who Got What,"As Bernard L. Madoff, the confessed Ponzi schemer, prepares to learn his sentence today, DealBook takes a graphical look at of some of the longest prison terms for financial fraud."
https://dealbook.nytimes.com/2009/10/30/madoffs-accountant-to-plead-guilty/,Madoff’s Accountant To Plead Guilty,Federal prosecutors indicated Friday that Bernard L. Madoff’s longtime auditor is expected to plead guilty next week and has agreed to cooperate with investigators.
https://www.nytimes.com/2015/09/11/nyregion/3-men-laundered-cartels-money-us-says.html,"3 Men Laundered Over $5 Billion for Drug Cartels, U.S. Says","Using the Chinese counterfeit market, a group of Colombians “provided the lifeline for drug cartels to operate and push illegal drugs into the United States,” the Drug Enforcement Administration said."
https://www.nytimes.com/2013/12/17/world/asia/india-ex-official-released-on-bail.html,India: Ex-Official Released on Bail,"Lalu Prasad, a once-powerful political leader from northern India, emerged from jail on Monday after spending more than two months behind bars on corruption charges."
https://dealbook.nytimes.com/2013/05/15/chinese-couple-settle-s-e-c-fraud-case/,Couple Settle Fraud Case Involving Chinese Company,The S.E.C. said Zou Dejun and Qiu Jianping of Rino International used money from a stock offering to buy a California home.
https://www.nytimes.com/2006/07/27/business/worldbusiness/27bank.html,Probation in Money-Laundering Case,A former executive at the Bank of New York and her husband admitted conspiring to use the bank to launder more than $7 billion from Russia.
https://www.nytimes.com/2012/01/17/technology/koobface-gang-that-used-facebook-to-spread-worm-operates-in-the-open.html,Web Gang Operating in the Open,"The Koobface gang, a Russian-based group, has grown wealthy by apparently spreading a computer worm on Facebook and other social networks and cashing in on various schemes."
https://www.nytimes.com/2002/12/06/nyregion/metro-briefing-new-york-manhattan-legal-impersonator-sentenced.html,Metro Briefing | New York: Manhattan: Legal Impersonator Sentenced,"Jonathan David Ghertler, who impersonated law partners in six major law firms in New York, Washington, San Francisco and Baltimore, is sentenced to just under six years in prison and ordered to pay restitution of over $200,000 to law firms he defr..."
/business/india-business/banks-will-have-to-reclassify-loans-given-to-hdil-as-fraud/articleshow/71470282.cms,Banks will have to reclassify loans given to HDIL as fraud,"Real estate developer HDIL is currently in default to various banks and has been admitted for proceedings under the Insolvency and Bankruptcy Code. The company has been trying to come out of the process and had paid Rs 98 crore to Bank of India, which was incidentally raised from the Punjab and Maharashtra Cooperative (PMC) Bank."
https://www.nytimes.com/2001/11/01/world/world-briefing-asia-indonesia-ex-military-chief-interrogated.html,World Briefing | Asia: Indonesia: Ex-Military Chief Interrogated,Former Indonesian military chief Gen Wiranto is questioned by prosecutors about $5.3 million that was siphoned out of state planning agency in 1999; he says he had taken a share of money 'to secure democracy' during independence vote in East Timor...
https://www.nytimes.com/2010/02/10/nyregion/10seabrook.html,Councilman Charged With Money Laundering,"Larry B. Seabrook was accused of diverting city money to himself, family and friends using closely controlled nonprofit groups."
https://www.nytimes.com/2000/06/15/business/us-says-mobsters-joined-stock-fraud.html,U.S. Says Mobsters Joined Stock Fraud,"Prosecutors have charged dozens of people with using stock manipulation, fraud and violence to steal from thousands of investors nationwide in a scheme that federal authorities are calling one of organized crime's most aggressive forays into the stock market."
https://www.nytimes.com/2003/06/13/nyregion/electrical-contractor-admits-that-it-defrauded-the-mta.html,Electrical Contractor Admits That It Defrauded the M.T.A.,Guilty pleas unsealed in Manhattan Criminal Court show that I-Lite Electric defrauded MTA of more than $2 million by submitting fake invoices; veteran MTA executives Howard Weissman and subordinate were dismissed last year; company will pay restit...
https://www.nytimes.com/2020/01/08/health/christian-health-insurance-subpoena.html,New York State Investigates Christian Health Cost-Sharing Affiliate,Subpoenas have been issued to a company that solicits memberships for a health insurance alternative that offers no guarantees for covering medical bills.
https://www.nytimes.com/2006/05/01/nyregion/01garifuna.html,Benefactor of Group of Caribbean Immigrants Is Accused of Defrauding Them,There is confusion and anger among the Garifuna people after a woman who claimed to be their advocate was arrested and accused of defrauding the immigrants.
https://www.nytimes.com/2017/06/19/nyregion/art-forger-is-accused-of-selling-fake-prints-again.html,Art Forger Is Accused of Selling Fake Prints. Again.,"Vincent Lopreto, who went to prison for a forgery scheme, started selling fake Damien Hirst prints just 15 days after being released, the authorities said."
https://www.nytimes.com/2020/05/29/us/politics/devos-trump-student-loan-rules.html,"Over Veterans’ Protests, Trump Vetoes Measure to Block Student Loan Rules","President Trump sided with Education Secretary Betsy DeVos over veterans’ groups, vetoing a measure that would have blocked new regulations that tighten access to student loan forgiveness."
https://www.nytimes.com/2001/04/13/business/global-conspiracy-on-construction-bids-defrauded-us.html,Global Conspiracy on Construction Bids Defrauded U.S.,Government officials and court documents indicate that group of international construction companies defrauded American government out of tens of millions of dollars earmarked for Egyptian water projects undertaken as part of Camp David peace acco...
https://www.nytimes.com/2017/09/22/business/sec-rules-cyber-security.html,S.E.C. Rules to Protect Investors From Cyberthreats Fall Short,"Requiring exchanges to strengthen security systems was wise. In light of recent breaches, excluding big trading firms from the rule looks risky."
https://dealbook.nytimes.com/2009/11/03/former-broker-pleads-guilty-in-ponzi-case/,Ex-Broker Pleads Guilty in Dreier Ponzi Case,"A former broker pleaded guilty on Monday to criminal charges of helping Marc S. Dreier, the Ponzi scheme operator, defraud hedge funds by selling millions of dollars of fictitious debt."
https://newoldage.blogs.nytimes.com/2013/12/06/tracking-a-thief-once-you-know-there-is-one/,"Tracking a Thief, Once You Know There Is One",Financial elder abuse statistics are not easy to pin down. It can also sometimes be hard to recognize that there is a problem.
https://www.nytimes.com/2020/02/29/world/europe/ireland-housing-politics-sinn-fein.html,The Driving Force in Irish Politics? Finding a Decent Place to Live,"A severe housing crisis has made life unbearable for many young people, who turned in droves to the previously toxic Sinn Fein party in this month’s election."
/city/hyderabad/hyderabad-tops-in-bank-frauds-in-south-india/articleshow/73129405.cms,Hyderabad tops in bank frauds in south India,"In a dubious distinction, Hyderabad has topped in banking frauds in south India. Out of 11 major frauds reported in 2019, seven cases have its origins in Hyderabad. Bengaluru and Chennai have two such cases each, according to a CBI data."
https://www.nytimes.com/2003/04/27/business/personal-business-diary-identity-theft-potential-and-real.html,"Identity Theft, Potential and Real","Fifty-one percent of respondents in Star Systems survey report that they are concerned about identity theft, and almost three-fourths say they are willing to provide government-issued photo identification card for certain financial transactions; F..."
https://www.nytimes.com/video/sports/100000003733411/fifas-valcke-on-10-million-transfer.html,FIFA’s Valcke on $10 Million Transfer,"Jérôme Valcke, the secretary general of FIFA, on Wednesday dismissed allegations of wrongdoing over $10 million in bank transactions at a news conference in Samara, Russia."
https://www.nytimes.com/2000/10/14/nyregion/for-corzine-the-confidential-has-become-political.html,"For Corzine, the Confidential Has Become Political",Analysis of Jon S Corzine's decision not to release his income tax returns as major issue in his Senate race in New Jersey; those familiar with Wall Street's routine secrecy find nothing implausible or unusual about his confidentiality accord with...
https://www.nytimes.com/2010/02/12/technology/12code.html,Programmer Indicted in Theft of Goldman Software,Sergey Aleynikov is accused of stealing the software that Goldman Sachs uses to make rapid-fire trades in the financial markets.
https://www.nytimes.com/2018/12/08/us/politics/trump-mueller-cohen-manafort.html,Prosecutors Effectively Accuse Trump of Defrauding Voters. What Does It Mean?,"President Trump’s lawyer minimized the importance of any potential campaign finance violations, but Democrats said they could potentially lead to impeachment."
https://schott.blogs.nytimes.com/2010/05/26/click-laundering/,Click Laundering,A sophisticated form of “click fraud” wherein bogus ad-revenue-generating Web-link “clicks” are disguised to appear as legitimate online enquiries.
/city/bhubaneswar/two-ex-bank-staff-arrested-for-loan-fraud-of-1-96-crore-in-odisha/articleshow/72158411.cms,Two ex-bank staff arrested for loan fraud of 1.96 crore in Odisha,The economic offences wing (EOW) of the Crime Branch here on Wednesday arrested two former employees of the Syndicate Bank's Burla branch in Sambalpur district for alleged loan fraud of Rs 1.96 crore.
https://www.nytimes.com/2004/07/02/world/arabs-seek-regional-group-to-fight-money-laundering.html,Arabs Seek Regional Group To Fight Money Laundering,Delegates to meeting on terrorist and criminal finance say financial officials from Arab countries are working behind closed doors to create first regional organization in Middle East and North Africa to fight money laundering; organization could ...
https://www.nytimes.com/2009/12/13/your-money/13haggler.html,What Charges Lurk on the Phone Bill,"The Haggler spends several days tracking down a small charge on a Verizon bill, taking a journey into the murky world of what may or may not be “cramming.”"
https://www.nytimes.com/2010/10/01/business/01mortgage.html,Foreclosures Slow as Document Flaws Emerge,Evictions are expected to slow as officials look into questionable foreclosure methods revealed by two big home lenders.
https://www.nytimes.com/2006/03/15/business/spitzer-sues-hr-block-saying-account-fees-were-deceptive.html,"Spitzer Sues H&R Block, Saying Account Fees Were Deceptive",New York's attorney general asserted that the company did not properly disclose the high fees of a retirement savings account.
https://www.nytimes.com/2002/10/18/business/enron-trader-pleads-guilty-to-conspiracy.html,Enron Trader Pleads Guilty To Conspiracy,"Enron Corp former senior trader Timothy N Belden pleads guilty to engaging in conspiracy that illegally manipulated California power market during state's energy crisis, driving up prices and generating millions of dollars in excess profits for hi..."
https://www.nytimes.com/2002/02/06/business/irish-bank-says-it-may-have-been-hit-by-750-million-fraud.html,Irish Bank Says It May Have Been Hit by $750 Million Fraud,"Allied Irish Banks, the Republic of Ireland's largest bank, said on Wednesday it had uncovered a suspected $750 million fraud at a U.S. subsidiary."
https://www.nytimes.com/2006/06/29/business/technology/world-business-briefing-asia-india-bank-employee.html,World Business Briefing | Asia: India: Bank Employee Charged in Theft,"Police in Bangalore, India, arrest Nadeem Kashmiri, employee of back-office unit of HSBC, British bank, on charges of stealing customers' confidential debit card data and helping defraud them of about $425,000 (S)"
https://www.nytimes.com/2020/02/27/us/college-admissions-william-singer-notes.html,Ringleader of Admissions Scandal Said Investigators Told Him to Lie,"While cooperating with federal agents, William Singer took notes saying that they instructed him to tell his clients that payments were bribes, not donations."
https://www.nytimes.com/2020/05/28/technology/clearview-ai-privacy-lawsuit.html,A.C.L.U. Accuses Clearview AI of Privacy ‘Nightmare Scenario’,"The facial recognition start-up violated the privacy of Illinois residents by collecting their images without their consent, the civil liberties group says in a new lawsuit."
https://www.nytimes.com/2010/02/19/arts/music/19ticket.html,Ticketmaster Reaches Settlement on Complaints of Deceptive Sales,The Federal Trade Commission said that customers paid for expensive tickets that never existed.
https://www.nytimes.com/2005/12/15/business/report-says-exaig-chief-defrauded-foundation-35-years-ago.html,Report Says Ex-A.I.G. Chief Defrauded Foundation 35 Years Ago,"New York State Atty Gen Eliot Spitzer submits report as part of his lawsuit against American International Group's former chief executive, Maurice R Greenberg, contending that Greenberg unfairly enriched himself and other AIG executives in series ..."
https://dealbook.nytimes.com/2009/08/25/woman-charged-in-professional-football-ponzi-scheme/,Woman Charged in Professional Football Ponzi Scheme,Federal prosecutors have charged a woman who once advised Michael Vick and several other football players with stealing $3 million from eight victims in a Ponzi scheme.
https://www.nytimes.com/2004/09/09/business/homestore-guilty-pleas.html,Homestore Guilty Pleas,"Clayton Chan, former Homestore vice president, and Geoffrey Infeld, former salesman, will plead guilty to charges they participated in fraudulent transactions to inflate company's advertising revenue; former employees Gregory Antoniono also agrees..."
https://carpetbagger.blogs.nytimes.com/2009/04/24/fbi-tracks-cyber-forgery-of-celebrity-tip-sheet-for-paparazzi/,FBI Tracks Cyber-Forgery of Celebrity Tip Sheet for Paparazzi,The FBI is trying to find out who sent out an apparently bogus version of a tip sheet for reporters and paparazzi.
https://www.nytimes.com/2005/07/29/business/manager-at-merrill-branch-pleads-guilty-to-tampering.html,Manager at Merrill Branch Pleads Guilty to Tampering,"A former Merrill Lynch compliance officer pleaded guilty yesterday to charges of conspiring to tamper with a witness in an industrywide investigation into how information on Wall Street trading desks is shared.      The compliance officer, Benjami..."
https://www.nytimes.com/2008/02/26/washington/26scotus.html,Justices Weigh if Cash Hidden Is Cash Laundered,The Supreme Court appeared ready to reject the government’s expansive definition of the term “money laundering” on Monday.
