url,title,summary
/business/india-business/currency-in-circulation-up-rs-19-7k-crore/articleshow/71623623.cms,Currency in circulation up Rs 19.7k crore,"The week ended October 4 saw currency in circulation jump to hit Rs 22 lakh crore - an increase of Rs 19,699 crore. The growth in the value of currency notes has crossed Rs 69,077 crore during the current financial year - a rise of 3.2%. The week before Diwali usually sees a surge in currency in circulation as consumption increases and payments in cash increase."
https://ideas.blogs.nytimes.com/2008/12/15/how-many-more-madoffs/,How Many More Madoffs?,"Finance | The trail of Bernard Madoff’s massive fraud seems to lead to closed books — suggesting there could be more like him. One commentator asks, was Madoff less a Ponzi huckster than simply another “massively over-leveraged” Wall Street operat..."
https://dealbook.nytimes.com/2008/03/27/former-national-century-ceo-convicted-of-witness-tampering/,Former National Century C.E.O. Convicted of Witness Tampering,"On Wednesday, a federal jury convicted the former chief executive of National Century Financial Enterprises of trying to bribe a witness in an upcoming $1.9 billion fraud trial. Lance Poulsen was accused of offering a former company executive $500,000 to give misleading testimony during the trial scheduled for August."
https://www.nytimes.com/2020/01/23/world/africa/angola-santos-embezzlement.html,Africa’s Richest Woman Set to Face Charges in Angola Over Embezzlement,"Isabel dos Santos, daughter of Angola’s former president, is set to be charged over crimes said to have been committed when she ran the state oil company, Sonangol."
https://www.nytimes.com/2006/08/04/business/charges-expected-on-options.html,Charges Expected on Options,"In December, Jacob Alexander, the chief executive of Comverse Technology, a New York-based communications software company, stepped before a crowd of politicians and diplomats at the New York Hilton to accept an award from the America-Israel Frien..."
https://dealbook.nytimes.com/2008/12/17/the-madoff-game-where-winning-means-losing/,Lots of Losers in the ‘Madoff Game’,How in the world can someone make $50 billion disappear?
https://wheels.blogs.nytimes.com/2013/02/12/the-charges-are-flying-over-a-test-of-teslas-charging-network/,The Charges Are Flying Over a Test of Tesla’s Charging Network,Some additional thoughts about a troubled test drive of the Tesla Model S along the East Coast.
https://dealbook.nytimes.com/2010/08/27/bail-set-at-10-million-for-accused-jersey-fraudster/,$10 Million Bail for Accused New Jersey Fraudster,"Eliyahu Weinstein, a New Jersey man charged with leading a $200 million Ponzi scheme that targeted fellow Orthodox Jews, was granted $10 million bail Thursday by an American judge."
https://www.nytimes.com/2005/01/28/business/riggs-pleads-guilty-in-moneylaundering-case.html,Riggs Pleads Guilty in Money-Laundering Case,Riggs Bank pleads guilty to repeatedly failing to report suspicious transactions in accounts held by leaders of Equatorial Guinea and former Chilean dictator Gen Augusto Pinochet; agrees to pay $16 million penalty as part of deal to avoid prosecut...
https://www.nytimes.com/2020/04/15/business/banks-earnings-virus.html,Big Banks Get Ready for Rough Days Ahead,"Bank of America, Goldman Sachs and Citigroup, all reporting quarterly earnings, said they had set aside billions of dollars in preparation for loan defaults."
https://www.nytimes.com/2011/04/24/magazine/mag-24lives-t.html,Upon Penalty of Life,"Victims’ relative ponders the trial, and the soul, of a killer."
https://www.nytimes.com/2020/03/09/business/wells-fargo-betsy-duke-resigns.html,"Wells Fargo’s Chairwoman, Betsy Duke, Resigns After Critical Report",Ms. Duke was expected to face lawmakers’ questions this week as fallout over the bank’s aggressive sales practices continues.
https://www.nytimes.com/2017/03/08/nyregion/jeremy-wilson-con-artist-convicted.html,Career Con Man Is Convicted of Forgery in Impersonation Scheme,"Jeremy Wilson, who has adopted more than two dozen aliases over the years, was arrested last year when he was found with a luxury BMW leased under a false name."
https://dealbook.nytimes.com/2007/02/28/mcafees-ex-lawyer-indicted/,McAfee’s Ex-Lawyer Indicted,"The former top lawyer of McAfee was charged on Tuesday with stock options tampering that muddied the finances of the computer security software maker. A federal grand jury indicted the lawyer, Kent Roberts, nine months after McAfee fired him as its general counsel for “improper” handling of stock options issued in 2000. The indictment includes seven criminal counts of fraud, accusing Mr. Roberts of deceiving investors by filing false statements with the Securities and Exchange Commission and falsifying McAfee’s books."
https://www.nytimes.com/2018/10/03/smarter-living/how-to-charge-phone-faster.html,How to Charge Your Phone Faster,No time to wait for your phone to charge up? No problem — these tips will get you the most battery power in the least amount of time.
https://www.nytimes.com/2006/06/21/world/middleeast/21cnd-abuse.html,Military Charges 8 With Murder of Iraqi,Seven marines and a Navy corpsman are being charged in connection with the shooting death of an Iraqi civilian in April.
https://www.nytimes.com/2006/06/09/us/09brfs-001.html,Longtime Mayor Is Arrested in Illinois,"The mayor of a Chicago suburb was arrested on federal corruption charges and accused of steering local business owners to an insurance agency, Ralph Weiner & Associates, of Wheeling, that in return paid him hundreds of thousands of dollars in brib..."
https://www.nytimes.com/2012/10/16/nyregion/suspect-arrested-in-counterfeiting-and-theft-from-atms.html,Suspect Arrested in Counterfeiting and Theft From A.T.M.’s,"Jean Carlo Pena was accused of loading automated teller machines at two Chase branches in Manhattan with crude counterfeits of bills and stealing $78,000 from them."
https://gadgetwise.blogs.nytimes.com/2013/03/28/tip-of-the-week-beware-of-tax-season-scams/,Tip of the Week: Beware of Tax Season Scams,E-mail messages that claim to be from the Internal Revenue Service asking for personal information are probably phishing scams.
https://www.nytimes.com/2008/01/23/business/23fund.html,Hedge Fund Founder Sentenced for Fraud,"James G. Marquez, a founder of several Bayou Management hedge funds, was sentenced to more than four years in prison for a scheme to defraud investors."
https://www.nytimes.com/2015/06/25/business/suspect-in-55-million-atm-scheme-is-extradited-to-us.html,Suspect in $55 Million A.T.M. Scheme Is Extradited to U.S.,"Federal prosecutors charged Ercan Findikoglu, who fought extradition from a German jail for 18 months, with computer intrusion, bank and wire fraud conspiracy and money laundering."
https://www.nytimes.com/2008/09/22/opinion/22kristol.html,A Fine Mess,A friend serving in the Bush administration tried to talk me out of my doubts about the $700 billion financial bailout. I’m not convinced.
https://www.nytimes.com/2006/07/30/business/yourmoney/investors-watch-your-wallets-if-managers-lead-the-buyout.html,"Investors, Watch Your Wallets if Managers Lead the Buyout","Andrew Ross Sorkin column, in light of record-breaking $31.6 billion leveraged buyout of HCA, warns that such deals tend to be poor ones for shareholders; review by Dealogic of buyout offers in last two years shows that shareholders received premi..."
https://www.nytimes.com/2008/12/12/business/12scheme.html,Prominent Trader Accused of Defrauding Clients,Charges say the scheme engineered by Bernard L. Madoff caused $50 billion in losses.
/business/india-business/pmc-bank-scam-3-accused-sent-in-judicial-remand-till-oct-23/articleshow/71612778.cms,PMC Bank scam: 3 accused sent in judicial remand till October 23,A court here on Wednesday remanded two top HDIL officials and Punjab and Maharashtra Cooperative (PMC) Bank's former chairman in judicial custody in connection with the multi-crore scam at the bank.
https://www.nytimes.com/2020/03/30/opinion/coronavirus-test-cost-bill.html,He Got Tested for Coronavirus. Then Came the Flood of Medical Bills.,Hidden costs for E.R. visits and other fees could cost people thousands of dollars.
https://www.nytimes.com/2011/01/11/us/politics/11delay.html,DeLay Sentenced to 3 Years in Conspiracy and Money-Laundering Case,"Tom DeLay, once the Republican leader in the House, was convicted in 2010 of illegally routing corporate contributions to state candidates in Texas."
https://dealbook.blogs.nytimes.com/2009/06/16/blogs/16dealbook-no-ponzi75425.html,No Ponzis for Madoff in Prison,"It's finally official: The convicted swindler Bernard L. Madoff, facing a lifetime behind bars for masterminding an enormous Ponzi scheme, will never work again in the securities industry."
https://krugman.blogs.nytimes.com/2015/07/25/the-old-man-and-the-cpi/,The Old Man and the CPI,"Affinity fraud, even without a fraudster."
https://www.nytimes.com/2007/06/10/business/yourmoney/10gret.html,Beware of Exploding Mortgages,"A tsunami of interest rate increases on adjustable-rate mortgages is coming, meaning that the worst of the subprime lending fiasco is far from over."
https://www.nytimes.com/2019/01/25/world/asia/nepal-everest-insurers-fraud.html,Everest Fraud Leads Insurers to Threaten a Boycott,An elaborate scheme centered on helicopter rescues from Everest and nearby peaks has defrauded insurance companies of millions of dollars.
https://www.nytimes.com/2009/07/10/business/10norris.html,"At Beazer Homes, It Was See No Evil and Pay No Penalty","Beazer Homes USA, a home builder, settled its legal crimes, but its top officials remain with the company."
https://www.nytimes.com/2018/01/22/business/kpmg-accountants-charged-audits.html,U.S. Accuses Accountants of Trying to Game Reviews of KPMG Audits,Prosecutors have charged five former KPMG employees and a former government accountant with plotting to help the auditing firm get a leg up in a regulatory review.
https://www.nytimes.com/2000/05/13/arts/two-auction-houses-disclose-confidential-records.html,Two Auction Houses Disclose Confidential Records,Auction houses Sotheby's and Christie's turn over confidential company information to lawyers representing customers who have accused them of price fixing; Judge Lewis A Kaplan will review records and decide if they should be kept confidential thr...
/city/mysuru/college-principal-loses-rs-4-lakh-in-otp-fraud/articleshow/75111811.cms,Mysuru: College principal loses Rs 4 lakh in OTP fraud,"In an OTP fraud, a pre-university college principal lost Rs 4 lakh after falling prey to the trick of linking Aadhaar number to his bank account."
https://www.nytimes.com/video/nyregion/100000001139899/timescast--disability-fraud.html,TimesCast | Disability Fraud,Eleven are charged in a scheme where Long Island Railroad workers made up to a billion dollars in false disability pension claims.
https://www.nytimes.com/2020/04/15/world/asia/north-korea-cyber.html,"U.S. Accuses North Korea of Cyberattacks, a Sign That Deterrence Is Failing","Through the attacks, a report says, the North steals and launders money, extorts companies and uses digital currencies to gain cash for its nuclear program."
https://www.nytimes.com/2014/07/25/business/media/ticketnetwork-settles-deceptive-marketing-complaint.html,TicketNetwork Settles Deceptive Marketing Complaint,The online company and two of its affiliates have agreed to pay $1.4 million to settle a complaint from federal and state authorities in Connecticut.
https://www.nytimes.com/2011/02/07/business/07nasdaq.html,Breach Tied to Nasdaq May Have Wider Effect,"As Nasdaq OMX sought to reassure the public, analysts said that the lingering effects may be to the company’s other expanding business lines rather than to its trading."
https://cityroom.blogs.nytimes.com/2011/01/24/hearing-delayed-for-consultant-charged-with-defrauding-bloomberg/,Hearing Delayed for Consultant Charged With Defrauding Bloomberg,A judge delayed a pretrial hearing for a political consultant accused of stealing $1.1 million from Mayor Michael R. Bloomberg.
https://fort-greene.blogs.nytimes.com/2009/07/21/blogs/21fort-greene-the-week14213.html,The Week in Crime: Elderly Woman Robbed,"An 82-year-old woman was robbed, taken to her apartment to get more money and then forced to withdraw still more from an ATM."
https://www.nytimes.com/2016/02/11/arts/design/knoedler-gallery-and-collectors-settle-case-over-fake-rothko.html,Knoedler Gallery and Collectors Settle Case Over Fake Rothko,"The collectors had sought $25 million in damages, accusing the defunct gallery and its former president of participating in a “racketeering scheme.”"
https://www.nytimes.com/2009/11/29/business/29digi.html,Don’t Take This Bait (but You’re Safe if You Do),"Online bank customers who give up their user names and passwords to phishers are protected by zero liability, an industry standard that offers full restitution."
https://www.nytimes.com/2020/05/13/business/paycheck-protection-program-small-business.html,Senators Question Lower Relief Loan Amounts for Small Businesses,"After learning that some received less than they asked for under the Paycheck Protection Program, three Democrats want more scrutiny of the banks."
https://www.nytimes.com/2020/02/28/business/dealbook/barclays-fraud-trial.html,3 Former Barclays Executives Are Cleared of Fraud Charges,British regulators had accused the men of lying about details of a deal struck with Qatar in 2008 that involved billions of dollars in emergency funding.
https://www.nytimes.com/2006/06/27/business/27citigroup.html,Citigroup Punishment Ends,"In May 2004, Citigroup was fined $70 million and cited for weak controls and lying to banking regulators. "
https://www.nytimes.com/2008/04/14/opinion/14sant.html,Unleash Legal Aid,"Legal aid societies have been swamped by the foreclosure crisis, and lawyers tied up in litigation are unavailable to other at-risk homeowners."
https://www.nytimes.com/2002/04/24/business/technology-hewlett-packard-is-accused-of-misleading-holders.html,Hewlett-Packard Is Accused of Misleading Holders,"Lawyers representing dissident director Walter B Hewlett deliver sweeping attack on integrity and credibility of management of Hewlett-Packard Co, contending that it repeatedly misled shareholders about projected gains from its planned purchase of..."
/city/patna/bank-manager-held-for-rs-3-95-crore-loan-fraud/articleshow/71140472.cms,Bank manager held for Rs 3.95 crore loan fraud in Patna,A Siliguri crime branch team arrested Union Bank of India branch manager Ashutosh Kumar from Pataliputra Colony police station area in Patna on Saturday for alleged involvement in fraudulent disbursal of Rs3.95 crore loan from Sevoke Road branch of the bank at Siliguri in Darjeeling district of West Bengal.
https://www.nytimes.com/2008/01/17/nyregion/17chop.html,61 Arrested in a Sting on Car Fraud,"A Queens “chop shop” operated by undercover detectives in a sting operation aimed at exposing car insurance fraud has led to the arrests of 61 suspects, including a city police officer and several other government workers, prosecutors said on Wedn..."
https://www.nytimes.com/2010/04/17/business/17bizbriefs-INTERNALREPO_BRF.html,Internal Report Faults S.E.C. In Stanford Case,"A report by the S.E.C.’s inspector general, H. David Kotz, disclosed that the commission did not conduct a meaningful investigation of the indicted money manager R. Allen Stanford until 2005."
https://www.nytimes.com/2010/05/08/world/americas/08canada.html,Top Court in Canada Limits Media on Sources,"The Supreme Court said that while journalists can offer sources confidentiality, prosecutors can later demand to know their identity."
/city/pune/pune-mlc-anil-bhosale-3-others-arrested-for-rs-71-crore-bank-fraud/articleshow/74310245.cms,"Pune MLC Anil Bhosale, 3 others arrested for Rs 71 crore bank fraud","The Pune crime branch on Tuesday night arrested Anil Bhosale, sitting MLC from the NCP and director of the Shivajirao Bhosale Cooperative Bank Limited, along with three others for an alleged economic fraud of Rs 71.78 crore involving the bank’s funds."
https://www.nytimes.com/2004/06/20/nyregion/briefings-courts-fugitive-arrested-in-berlin.html,FUGITIVE ARRESTED IN BERLIN,"Fugitive philanthropist and violin collector Herbert Axelrod, who fled US in April following tax fraud charges, is arrested at Berlin airport enroute from Switzerland (S)"
https://www.nytimes.com/2002/02/13/business/technology-briefing-hardware-ftc-cites-spam-scheme.html,Technology Briefing | Hardware: F.T.C. Cites 'Spam' Scheme,"Federal Trade Commission settles charges against seven people for operating illegal e-mail schemes that promised quick and easy money; defendants sent chain letters with slight variations of same message: $46,000 or more within 90 days; FTC messag..."
/business/india-business/what-steps-taken-to-help-pmc-bank-depositors-hc-asks-rbi/articleshow/71889660.cms,"What steps taken to help PMC Bank depositors, HC asks RBI","The Bombay high court on Monday sought to know from the Reserve Bank of India (RBI) what steps it has taken to protect the interests of depositors of the crisis-hit Punjab and Maharashtra Co-operative (PMC) Bank. A division bench of Justices S C Dharmadhikari and R I Chagla was hearing a bunch of petitions filed by the bank depositors, challenging restrictions imposed by the RBI on withdrawals."
https://www.nytimes.com/2007/11/15/business/15insider.html,Broker Is Expected to Plead Guilty,"A former broker at Bear Stearns, Ken Okada, is expected to plead guilty in a wide-ranging insider-trading case."
https://www.nytimes.com/2017/01/21/business/dealbook/quicken-loans-dan-gilbert-mortgage-lender.html,"Quicken Loans, the New Mortgage Machine","The mortgage lender, like the big banks before it, has come under regulatory scrutiny. Its feisty founder, Dan Gilbert, is unfazed."
https://www.nytimes.com/2003/10/12/realestate/q-a-collecting-unpaid-common-charges.html,Collecting Unpaid Common Charges,Q -- I am a board member of a 30-unit condominium in Brooklyn. Several unit owners are not paying their common charges. One person owes about five years' worth.
https://www.nytimes.com/2000/12/23/business/company-news-october-payments-to-retirement-funds-missed.html,OCTOBER PAYMENTS TO RETIREMENT FUNDS MISSED,Trans World Airlines fails to make some payments to worker retirement funds; tries to refinance $100 million loan (S)
/city/chandigarh/chandigarh-man-loses-rs-1-4-lakh-in-online-shopping-fraud/articleshow/74644759.cms,Chandigarh: Man loses Rs 1.4 lakh in online shopping fraud,"A city resident has been duped of Rs 1.47 lakh by online cheaters, who lured him with an offer to win an iPhone X, the police said on Sunday."
/city/pune/cops-solve-9-bank-fraud-cases-after-trios-arrest/articleshow/72013793.cms,Pune cops solve nine bank fraud cases after trio’s arrest,"The Airport police on Monday claimed to have solved nine bank fraud cases, including that of Bank of Maharashtra, following the arrest of three men."
https://dealbook.nytimes.com/2012/07/16/scathing-report-details-money-laundering-problems-at-hsbc/,Regulators and HSBC Faulted in Report on Money Laundering,"The global bank HSBC has been used by Mexican drug cartels, Saudi Arabian banks with terrorist ties, and Iranians who wanted to circumvent United States sanctions, a report from a Senate subcommittee says."
https://www.nytimes.com/2012/02/03/business/ex-partner-says-stanford-was-dictatorial-in-fraud-case.html,Witness Says He Warned Stanford on Ponzi Plan,"James Davis, former chief financial officer of the Stanford Financial Group, testified against R. Allen Stanford, the Texas financier accused of defrauding investors in a $7 billion Ponzi scheme."
https://www.nytimes.com/2016/02/24/business/dealbook/signature-bank-sued-over-connection-to-ponzi-scheme.html,Signature Bank Sued Over Connection to Ponzi Scheme,Investors claim Signature helped a money manager pull off a $66 million fraud by ordering him to shift money around accounts he held at the bank to cover overdrafts.
https://www.nytimes.com/2018/10/11/arts/music/fyre-festival-organizer-sentenced-fraud.html,Fyre Festival Organizer Sentenced to Six Years in Federal Prison,Billy McFarland had pleaded guilty to wire-fraud charges in the Fyre debacle as well as two more fraud counts for running a sham ticket-selling business.
https://www.nytimes.com/2019/03/07/us/gofundme-homeless-scam-guilty.html,"Woman and Homeless Man Plead Guilty in $400,000 GoFundMe Scam","A heartwarming but false story led to a flood of donations. “I had to make something up so people will feel bad,” one conspirator told a friend."
https://www.nytimes.com/2013/10/11/business/seat-belt-supplier-to-pay-71-million-in-antitrust-case.html,Antitrust Fine for Supplier of Seat Belts,The Takata Corporation of Japan was fined by the United States Justice Department as part of an international auto parts price-fixing investigation.
/city/mumbai/man-defrauds-sbi-of-rs1-04cr-jailed-for-life/articleshow/69121050.cms,67-year-old South Bombay resident is eight to get life for bank fraud,"In the third such judgment in a week, a special CBI court on Tuesday convicted and sentenced a 67-year-old man to life imprisonment and fined him Rs 5.03 crore for cheating State Bank of India of Rs 1.04 crore in 1996-97."
https://www.nytimes.com/2020/05/07/us/politics/justice-department-antitrust-drugs.html,Generic Drug Maker Admits to Fixing Prices for Cholesterol Medication,"For conspiring to inflate drug prices, Apotex will pay $24 million and cooperate with the Justice Department’s investigation into the pharmaceutical industry."
https://www.nytimes.com/2004/06/06/nyregion/in-business-company-charged-in-illegal-hauling.html,Company Charged In Illegal Hauling,"Nacirema Industries, after probe by Westchester Solid Waste Commission, is charged with hauling construction and demolition debris from Bronxville School District without proper license; faces fine of up to $10,000 if convicted (S)"
https://www.nytimes.com/2006/06/29/nyregion/29mbrfs-005.html,Queens: Fortunetellers Arrested,"Three Queens fortunetellers were arrested on Tuesday after they tried to charge undercover investigators for services including exorcism and rekindling a past romantic relationship, the authorities said. The fortunetellers, who operated out of apa..."
https://dealbook.nytimes.com/2010/06/23/ex-socgen-chief-has-sharp-words-for-trader/,Ex-SocGen Chief Has Sharp Words for Trader,"Daniel Bouton, the former chairman and chief executive of Société Générale, stood Tuesday for the first time alongside Jérôme Kerviel, the former trader whom Mr. Bouton once labeled a “terrorist” for generating nearly 5 billion euros in losses for..."
https://www.nytimes.com/2017/04/20/technology/personaltech/whatsapp-voice-mail-scam.html,Ignoring a WhatsApp Scam,"Hackers have been trying to fool people for years by hiding malicious software in seemingly friendly messages, but don’t fall for it."
https://www.nytimes.com/2009/08/18/technology/18card.html,3 Indicted in Theft of 130 Million Card Numbers,"In the largest identity theft case ever, stolen data was sold and used to make fraudulent purchases."
https://www.nytimes.com/2007/08/27/opinion/27mon2.html,The College Credit Scam,Colleges need to do more to protect their students from taking on credit card debt that can severely damage their economic prospects once they join the world of work.
https://laughlines.blogs.nytimes.com/2008/03/14/her-real-name-is-ashley-dupre/,‘Her Real Name Is Ashley Dupre’,"Aired Thursday night on “Jimmy Kimmel Live” on ABC: So you probably know that The New York Times was able to find Kristen, the 22-year-old prostitute that Eliot Spitzer allegedly paid $1,000 an hour. Her real name is Ashley Dupre. Here’s what’s going to happen with her. She’s going to pose naked for Playboy, she’ll do a season of “Celebrity Apprentice,” maybe a “Surreal Life,” then she’ll top it off by having a baby with Pauly Shore."
https://www.nytimes.com/2015/02/15/world/bank-hackers-steal-millions-via-malware.html,Bank Hackers Steal Millions via Malware,A report by a Russian cybersecurity firm says a global gang of thieves penetrated banking systems to steal millions of dollars.
https://bits.blogs.nytimes.com/2014/09/08/home-depot-confirms-that-it-was-hacked/,Home Depot Data Breach Could Be the Largest Yet,Home Depot confirmed on Monday that hackers had attacked its cash register system. Information on more than 60 million credit cards may have been stolen.
https://www.nytimes.com/2020/05/18/us/Voting-republicans-trump.html,"Freed by Court Ruling, Republicans Step Up Effort to Patrol Voting","Officials seek to recruit 50,000 poll watchers and spend millions to fight voter fraud. Democrats say the real goal is to stop them from voting."
https://www.nytimes.com/2012/10/03/opinion/eric-schneiderman-presents-his-case.html,Mr. Schneiderman Presents His Case,New York’s attorney general uses state law to expose a broad pattern of mortgage fraud.
https://www.nytimes.com/2005/01/26/business/judge-calls-catalog-outlet-a-usurer-in-disguise.html,Judge Calls Catalog Outlet a Usurer in Disguise,"New York Supreme Court Justice Bernard Malone Jr rules that NY Catalog Sales, catalog company based near Fort Drum Army base in Watertown, is lender in disguise--making illegal short-term loans to military and civilian customers at annual interest..."
https://dealbook.nytimes.com/2011/10/19/lawsuit-claims-herb-allen-forged-a-signature/,Lawsuit Accuses Head of Allen & Co. of Forgery,"Herbert A. Allen, the head of the investment bank Allen & Company, was accused in a lawsuit of forging his dying cousin’s signature to protect a family ranch."
