url,title,summary
/city/rajkot/bhuj-fraudsters-dupe-jaipur-jeweller-of-rs-17l/articleshow/74542806.cms,Bhuj fraudsters dupe Jaipur jeweller of Rs 17 lakh,"Three Bhuj-based frauds who conned a Jaipur-based jeweller of Rs 17 lakh on February 21, were arrested on Saturday night. Police said accused Nawab Traya, Iqbal Chauhan and Hasan Naude had cheated Pawan Soni."
/city/lucknow/lucknow-man-clicks-on-sms-link-loses-rs-1-4-lakh/articleshow/74665621.cms,"Lucknow man clicks on SMS link, loses Rs 1.4 lakh",A 41-year-old man who had applied for a internet-based TV connection was duped of Rs 1.4 lakh by a cyber fraudster.
https://www.nytimes.com/2019/03/06/arts/design/hitler-paintings-fake.html,Are These Paintings Really by Hitler? German Authorities Are Investigating,"Prosecutors are tamping down on auctions of works apparently by the dictator, not because of moral questions, but because many of them are fake."
https://www.nytimes.com/2003/12/16/business/accord-lets-first-data-acquire-concord-efs.html,Accord Lets First Data Acquire Concord EFS,"First Data Corp reaches late agreement to settle Justice Department lawsuit blocking its planned $7 billion acquisition of Concord EFS; agrees to sell its 64 percent stake in NYCE Corp, which routes debit card transactions, and permit NYCE to oper..."
https://www.nytimes.com/2000/02/21/world/israel-seen-as-paradise-for-money-laundering.html,Israel Seen as Paradise for Money Laundering,"Israel is moving to outlaw money laundering, which has been kept legal in order to help immigrants, who frequently have to circumvent restrictions on expatriating money when they leave their native countries; these policies are being exploited by ..."
https://www.nytimes.com/2012/11/27/world/asia/kabul-bank-audit-details-extent-of-fraud.html,Audit Says Kabul Bank Began as ‘Ponzi Scheme’,The report asserts that Afghanistan’s largest financial institution existed primarily to allow a narrow clique tied to President Hamid Karzai’s government to siphon riches from depositors.
https://dealbook.nytimes.com/2009/07/07/3-accused-of-running-ponzi-scheme/,3 Accused of Running Ponzi Scheme,Federal regulators have frozen the assets of a Dallas company accused of running a $485 million Ponzi scheme centered on the oil and gas industry.
https://www.nytimes.com/2018/10/16/opinion/facebook-data-breach-regulation.html,Why It’s So Hard to Punish Companies for Data Breaches,"It’s difficult to determine how and where companies like Facebook went wrong, which makes regulation challenging."
https://www.nytimes.com/video/business/1194817094159/a-victim-of-equity-stripping.html,A Victim of Equity Stripping,A Chicago woman who fell behind on her mortgage payments became a victim of a common fraud known as equity stripping.
https://www.nytimes.com/2011/07/04/business/04views.html,Debt Collections Elude Uncle Sam,Federal agencies have little incentive to go after fines because they don’t actually keep the money.
https://www.nytimes.com/2006/08/25/washington/25brfs-003.html,Washington: Storm Fraud Charges,"The owner of a debris-removal company and three employees hired to monitor its work have been charged in a conspiracy to cheat the government of nearly $720,000 after Hurricane Katrina, federal officials said. The Justice Department said the owner..."
https://bits.blogs.nytimes.com/2012/09/19/an-alert-system-for-security-breaches/,An Alert System for Security Breaches,"With security breaches on the rise, companies are beginning to offer new alert systems that tell consumers when their usernames, passwords, credit cards, Social Security numbers and the like pop up on on the Internet."
https://dealbook.nytimes.com/2010/04/01/broker-who-aided-dreier-sentenced-to-prison/,Broker Who Aided Dreier Sentenced to Prison,A former securities broker who admitted helping a prominent New York City lawyer dupe hedge funds into making tens of millions of dollars in bogus investments has been sentenced to nearly four years in prison.
/city/chennai/cbi-registers-6-cases-of-fraud-against-ex-official-of-pnb/articleshow/73052126.cms,Chennai: CBI registers 6 cases of fraud against ex-official of PNB,"Central Bureau of Investigation (CBI), Chennai, has registered six cases against Shane Sylvester Rozario, a former assistant general manager of Punjab National Bank’s Mylapore branch,"
https://www.nytimes.com/2012/05/15/opinion/bruni-the-rights-righteous-frauds.html,The Right’s Righteous Frauds,Many of the country’s self-appointed moralists are hypocrites whose own histories tumble out the window as soon as there is a check to be cashed.
https://www.nytimes.com/2002/10/08/nyregion/ocean-township-mayor-admits-wrongdoing-and-resigns.html,Ocean Township Mayor Admits Wrongdoing and Resigns,"Terrance D Weldon resigns as mayor or Ocean Township, NJ, and city manager of Asbury Park, saying he committed 'illegal actions' connected to his job as mayor (S)"
https://www.nytimes.com/2015/05/14/business/dealbook/5-big-banks-expected-to-plead-guilty-to-felony-charges-but-punishments-may-be-tempered.html,"5 Big Banks Expected to Plead Guilty to Felony Charges, but Punishments May Be Tempered","As much as prosecutors may want to punish the banks, which are accused of rigging the price of foreign currencies, they are mindful that too harsh a penalty could imperil the businesses."
https://dealbook.nytimes.com/2011/10/27/judge-rakoff-skeptical-of-s-e-c-settlement-with-citigroup/,Judge Rakoff Questions S.E.C. Accord With Citigroup,"Suggesting he is skeptical of the settlement, Judge Jed S. Rakoff laid out what he wanted the sides to answer at next month’s federal court hearing on the proposed $285 million deal."
/city/pune/techie-loses-rs-3-3-lakh-in-credit-card-cloning-fraud/articleshow/73817645.cms,Pune techie loses Rs 3.3 lakh in credit card cloning fraud,"Cybercrooks made online transactions of 3,372 pounds in London in the first week of January by cloning the credit card of a city-based software engineer, who’s currently in France with an office assignment."
https://www.nytimes.com/2000/04/13/nyregion/metro-business-actor-in-sopranos-is-sentenced-in-scam.html,Metro Business; Actor in 'Sopranos' Is Sentenced in Scam,"Thomas Bifalco Jr, actor who had role this season in HBO series The Sopranos, is sentenced to two to six years in prison for selling $300,000 in worthless stock to elderly people (S)"
https://www.nytimes.com/2003/03/30/weekinreview/march-23-29-international-bail-for-berezovsky.html,March 23-29: INTERNATIONAL; BAIL FOR BEREZOVSKY,"Russia's billionaire fugitive, Boris A. Berezovsky, was arrested by British police, and then immediately released on bail, as authorities in London moved on a request by Russia to extradite the businessman. Russian authorities accuse Mr. Berezovsky and a colleague of defrauding the state of about $18 million in 1994 and 1995. The Kremlin claims that Mr. Berezovsky is a thief. Mr. Berezovsky claims that he is being pursued because the Kremlin wants to silence him as a political opponent. The vast majority of Russians think both are true. Sabrina Tavernise"
https://dealbook.nytimes.com/2006/08/03/8-brokers-charged-with-fraud/,8 Brokers Charged With Fraud,"Eight Wall Street stockbrokers have been indicted for allegedly defrauding hundreds of customers of at least $13 million over five years, prosecutors said on Wednesday."
https://www.nytimes.com/2002/08/07/sports/baseball-doubleday-allegations-looming-over-talks.html,Doubleday Allegations Looming Over Talks,Major League Baseball players union and owners react to New York Mets co-owner Nelson Doubleday's accusations that MLB manipulated franchise values in process of trying to sell his half of team to co-owner Fred Wilpon (M)
https://www.nytimes.com/2005/05/26/nyregion/metro-briefing-new-york-white-plains-19-charged-in-counterfeiting.html,Metro Briefing | New York: White Plains: 19 Charged In Counterfeiting Ring,"Nineteen men have been arrested on charges related to a check counterfeiting ring, the Westchester County district attorney, Jeanine F. Pirro, said yesterday. Ms. Pirro said investigators followed the men, who were operating from an Elmsford motel..."
https://www.nytimes.com/2005/09/03/world/europe/russian-held-in-scheme-to-launder-un-bribes.html,Russian Held in Scheme to Launder U.N. Bribes,"A Russian diplomat who is the chairman of a United Nations budget watchdog committee has been indicted in New York on charges of conspiring to launder hundreds of thousands of dollars in bribes, federal authorities announced yesterday.     The dip..."
https://www.nytimes.com/2019/12/02/opinion/immigration-detention-prison.html,Abolish Immigration Prisons,"We should shut down these institutions, end the suffering they cause and redirect the money."
https://www.nytimes.com/2011/12/08/nyregion/94-arrested-over-fraud-exploiting-td-bank-loophole.html,94 Indicted in Scheme Exploiting a Bank,Prosecutors said that ringleaders paid recruits small sums to open accounts at TD Bank for the purpose of exploiting a loophole in the bank’s money-transfer practices.
https://www.nytimes.com/2017/07/21/business/dealbook/wells-fargo-confidential-data-release.html,Wells Fargo Accidentally Releases Trove of Data on Wealthy Clients,A plaintiff suing an employee of Wells Fargo Advisors was sent a CD containing thousands of sensitive client records — which came from a lawyer for the bank.
/business/india-business/kotak-bank-q4-results-to-be-out-today-shares-up-2/articleshow/75708863.cms,"Kotak Bank Q4 results to be out today, shares up 2%","Indian private sector lender Kotak Mahindra Bank is going to announce its fourth-quarter earnings numbers on Wednesday, May 13, 2020."
https://www.nytimes.com/2000/09/28/nyregion/metro-business-guilty-pleas-in-stock-scam.html,Metro Business; Guilty Pleas in Stock Scam,"New York attorney general's office says that employees of Renaissance Capital Management Inc, Long Island investment company accused of defrauding nearly 90 people out of $3.2 million, have pleaded guilty to several charges and will all be sentenc..."
https://www.nytimes.com/2015/02/07/business/data-breach-at-anthem-may-lead-to-others.html,Data Breach at Anthem May Forecast a Trend,"Medical identify theft has become a booming business, according to security experts, who warn that other health care companies are likely to be targets."
https://www.nytimes.com/2009/04/03/opinion/03krugman.html,China’s Dollar Trap,China now owns so many dollars that it can’t sell them off without driving the dollar down and triggering the very capital loss its leaders fear.
https://www.nytimes.com/2019/11/10/business/Apple-credit-card-investigation.html,Apple Card Investigated After Gender Discrimination Complaints,A prominent software developer said on Twitter that the credit card was “sexist” against women applying for credit.
https://www.nytimes.com/2002/07/18/international/europe/new-allegations-lead-to-ouster-of-german-defense.html,New Allegations Lead to Ouster of German Defense Minister,"The German chancellor, Gerhard Schröder, an underdog for reelection in September, fired his defense minister following allegations of financial improprities."
https://www.nytimes.com/2003/06/19/nyregion/metro-briefing-new-york-brooklyn-lawyer-denies-theft.html,Metro Briefing | New York: Brooklyn: Lawyer Denies Theft,"Brooklyn lawyer Sandra E Roper is charged with stealing $9,000 from her client, Mary Lee Ward, and then lying about it to state grievance committee; is also accused of forging retainer agreement; pleads not guilty; photo (S)"
https://www.nytimes.com/2006/04/05/business/a-single-trial-for-18-named-in-tax-shelters.html,A Single Trial for 18 Named in Tax Shelters,"A federal judge declined yesterday to grant separate trials for 18 people charged in the sale of questionable tax shelters, affirming that they must stand trial together this fall.     The judge, Lewis A. Kaplan, in United States District Court in..."
https://www.nytimes.com/2020/02/21/business/wells-fargo-settlement.html,The Price of Wells Fargo’s Fake Account Scandal Grows by $3 Billion,The bank reached a settlement with federal prosecutors and the Securities and Exchange Commission after abusing customers.
https://www.nytimes.com/video/us/1247465652568/military-charges-hasan.html,Military Charges Hasan,Military prosecutors have charged Maj. Nadil Malik Hasan with 13 counts of murder. MSNBC video.
https://dealbook.nytimes.com/2010/08/05/hsbc-subject-of-u-s-money-laundering-probe/,HSBC Subject of U.S. Money Laundering Inquiry,"American authorities are investigating the U.S. division of global banking group HSBC over its compliance with anti-money laundering procedures, according to a regulatory filing."
https://www.nytimes.com/2020/03/24/business/coronavirus-stock-buybacks.html,The Stock Buyback Binge May Be Over. For Now.,"Companies are hitting the pause button on share buybacks, which have suddenly become politically and financially unpalatable."
https://www.nytimes.com/2005/06/09/nyregion/schools-chief-and-roommate-inflated-bills-in-scam-officials-say.html,"Schools Chief and Roommate Inflated Bills in Scam, Officials Say","The former superintendent of Roslyn's schools helped his longtime roommate inflate bills as a contractor to the school district and then shared in the money, according to new criminal charges disclosed on Wednesday.     That charge was among sever..."
https://www.nytimes.com/2009/06/13/your-money/mortgages/13scam.html,Avoiding Firms That Prey On Troubled Homeowners,"Businesses falsely promising to save homeowners from default are bilking customers, sometimes for thousands of dollars."
https://www.nytimes.com/2014/04/19/business/michaels-stores-confirms-breach-involving-three-million-customers.html,Michaels Stores’ Breach Involved 3 Million Customers,"The company said that two security firms had found evidence of a breach at Michaels, a crafts retailer, and at a subsidiary, Aaron Brothers, a framing company."
https://www.nytimes.com/2019/09/22/nyregion/trump-tower-theft-jewelry.html,"Trump Tower Theft: $353,000 in Jewelry Reported Stolen","Residents of two apartments in the president’s namesake residence on Fifth Avenue in New York told the police that diamonds, emeralds and sapphires were missing."
https://www.nytimes.com/2008/01/19/nyregion/19union.html,Ex-Union Chief Pleads Guilty,"The former president of the union representing 15,000 New York City school bus drivers pleaded guilty on Friday to extortion and receiving bribes as part of a racketeering conspiracy."
https://www.nytimes.com/2018/05/15/business/dealbook/fraud-sophisticated-investors.html,Can Sophisticated Investors Be Defrauded? Two Cases Raise Hurdles,Two recent cases show that misstatements are not necessarily enough to prove securities fraud when sophisticated investors are involved.
https://www.nytimes.com/2001/11/22/nyregion/metro-briefing-new-jersey-trenton-lawsuit-in-suspicious-accidents.html,Metro Briefing | New Jersey: Trenton: Lawsuit In Suspicious Accidents,"Allstate files suit against 40 people who collected more than $1 million in medical claims arising out of traffic accidents that were later alleged to have been staged in and around Morris County, NJ (S)"
https://www.nytimes.com/2020/04/30/business/europe-economy-coronavirus-recession.html,"European Slump Is Worst Since World War II, Reports Show","The European Central Bank will pay banks to lend money after the economy shrank the most in decades. The worst is yet to come, the eurozone’s top central banker warned."
https://www.nytimes.com/slideshow/2012/02/19/automobiles/19future-slides.html,Charging Into the Future,"Automakers continue to place big bets on electric vehicles. Here are some models, arriving in the next two years, to keep an eye on."
https://www.nytimes.com/2003/04/01/nyregion/15-are-accused-of-involvement-in-a-multinational-drug-ring.html,15 Are Accused of Involvement In a Multinational Drug Ring,"Federal prosecutors in Brooklyn say they have broken up multinational ring that laundered tens of millions of dollars in proceeds from sale of cocaine and ecstasy; 15 are arrested, including Natan Banda, who ran operation (M)"
https://www.nytimes.com/2016/02/27/business/dealbook/ubs-faces-money-laundering-and-fraud-inquiry-in-belgium.html,UBS Faces Money Laundering and Fraud Inquiry in Belgium,"The Swiss bank is suspected of having directly approached Belgian customers to encourage them to engage in transactions meant to evade taxes, according to Brussels prosecutors."
https://dealbook.nytimes.com/2013/09/16/barclays-faces-fine-in-qatar-deal/,Barclays Faces Fine in Qatar Deal,Barclays said on Monday that Britain’s financial regulator had concluded the bank acted “recklessly” when it raised emergency money from Qatari investors during the financial crisis and could be fined $79 million.
https://www.nytimes.com/2020/05/18/business/wework-rent-coronavirus.html,"WeWork Wants a Rent Break. Its Customers Do, Too.",Some who rent space from the troubled company say it has not been generous with them even as it seeks concessions from building owners.
https://www.nytimes.com/2011/09/30/business/banks-to-make-customers-pay-debit-card-fee.html,Banks to Make Customers Pay Fee for Using Debit Cards,Banks are imposing new charges on their customers to make up for the revenue they expect to lose because of a cap on what they can charge merchants for debit-card transactions.
https://www.nytimes.com/2012/03/24/us/california-charges-in-coliseum-scheme.html,California: Charges in Coliseum Scheme,Six people have been indicted on charges that they siphoned millions of dollars from the Los Angeles Memorial Coliseum.
https://www.nytimes.com/2017/03/17/books/review/madame-president-helene-cooper.html,A Woman in Charge: A Biography of Liberia’s President,"In “Madame President,” Helene Cooper traces the life of Ellen Johnson Sirleaf, Liberia’s head of state."
https://www.nytimes.com/2005/11/30/nyregion/chasing-fraud-in-medicaid.html,Chasing Fraud in Medicaid,"Nassau County Executive Thomas R. Suozzi urged the state on Tuesday to crack down on managed care companies that process fraudulent applications for Medicaid.     At a news conference heavy with theatrics as well as politics, Mr. Suozzi played a v..."
https://dealbook.nytimes.com/2012/12/10/hsbc-said-to-near-1-9-billion-settlement-over-money-laundering/,HSBC to Pay $1.92 Billion to Settle Charges of Money Laundering,The announcement of a settlement on Tuesday came after state and federal authorities decided against indicting the British bank in a money-laundering case.
https://www.nytimes.com/2008/06/03/world/asia/03nations.html,"North Korea Didn’t Dupe U.N. Office, Report Says",The review’s conclusion was that aid money from the United Nations Development Program had been used for intended projects.
https://www.nytimes.com/2002/03/10/nyregion/money-fake-fifty-passed-at-library-in-bedford.html,Fake Fifty Passed At Library In Bedford,"Article on counterfeit $50 bill collected, probably as book fine, at Bedford Free Library in Bedford, NY; local Secret Service agent Larry Saez says passing of fake bills is on rise thanks to ease provided by state-of-art imaging and printing equi..."
https://dealbook.nytimes.com/2012/06/26/australian-billionaire-rinehart-threatens-to-dump-fairfax-media-stake/,Australian Billionaire Threatens to Dump Fairfax Media Stake,"Georgina Rinehart, Asia’s richest woman, says her privately held Hancock Prospecting may sell its 19 percent stake in the Australian publisher Fairfax Media because Hancock has been denied representation on the board."
/business/india-business/icici-pru-idfc-may-back-idfc-firsts-rs-2000cr-issue/articleshow/75459379.cms,"ICICI Prudential, IDFC may back IDFC First’s Rs 2,000 crore issue","ICICI Prudential Life Insurance and IDFC Ltd may subscribe to a majority of the Rs 2,000-crore preferential issue being planned by IDFC First Bank, as it looks to create a war chest to fight any liquidity crisis. While ICICI Prudential is expected to invest Rs 500-600 crore, parent IDFC is likely to pump in about Rs 800 crore to maintain its 40% stake."
https://www.nytimes.com/2013/09/18/technology/firm-that-sent-42-million-texts-settles-in-spam-case.html,Firm That Sent 42 Million Texts Settles in Spam Case,"Rentbro and its principals, Daniel Pessin and Jacob Engel, agreed to turn over all remaining assets and to repay up to $377,321."
https://www.nytimes.com/2015/07/18/business/cvs-and-walmart-canada-are-investigating-a-data-breach.html,CVS and Walmart Canada Are Investigating a Data Breach,The retailers temporarily shut down their online photo processing services to determine the extent of a possible credit card data breach.
https://www.nytimes.com/2000/07/07/business/cinar-recoups-part-of-122-million-unauthorized-investment.html,Cinar Recoups Part of $122 Million Unauthorized Investment,"Cinar Corp says it has recovered just under half of $122 million that was invested through Globe-X Management of Bahamas without board approval; expects to receive $3.6 million from Globe-X, bringing to $60 million amount it has recouped Charest t..."
https://www.nytimes.com/2020/03/06/your-money/social-security-fraud-calls.html,How Not to Become a Victim of Social Security Fraud Calls,"Regulators report thousands of complaints about the calls. Here are some tips on protecting yourself, and your money."
https://prescriptions.blogs.nytimes.com/2010/06/15/whats-the-penalty-for-not-having-insurance/,What’s the Penalty for Not Having Insurance?,"In 2016, the financial penalty for failing to have health insurance will be $695 for an individual or 2.5 percent of household income, whichever is greater."
https://www.nytimes.com/2002/12/25/nyregion/metro-briefing-new-york-manhattan-bail-denied-in-money-laundering.html,Metro Briefing | New York: Manhattan: Bail Denied In Money Laundering,Three Colombians extradited to United State are held without bail in money-laundering scheme in New York City (S)
https://dealbook.nytimes.com/2010/02/04/us-report-details-money-laundering/,U.S. Report Details Money Laundering,"A new report sheds new light on how banks like Citigroup, Wachovia and Bank of America unwittingly shifted hundreds of millions of dollars on behalf of African politicians, their relatives and associates."
https://www.nytimes.com/2018/02/16/us/politics/richard-pinedo-russia-bank-accounts-guilty-plea-mueller.html,"Russians Bought Bank Accounts From California Man, Mueller Says","A California man illegally provided hundreds of bank account numbers to a Russian social media operation, the special counsel revealed."
https://www.nytimes.com/2011/12/19/technology/as-patient-records-are-digitized-data-breaches-are-on-the-rise.html,Digital Data on Patients Raises Risk of Breaches,"As more doctors and hospitals have digitized patient records, the number of reported breaches has increased 32 percent this year from last year at a cost of $6.5 billion to the industry."
/city/kolkata/4-held-for-forgery-of-nscs-kvps/articleshow/73258514.cms,"West Bengal: 4 held for forgery of NSCs, KVPs",The detective department nabbed four men on Monday night from various parts of the city and South 24 Parganas for allegedly duping a public bank using 60 fake National Savings Certificates (NSC) and securing a total loan of Rs 40 lakh.
https://www.nytimes.com/2006/08/15/nyregion/15mbrfs-002.html,Brooklyn: School Worker Accused of Theft,"A city employee was arrested yesterday on charges of grand larceny, accused of stealing about $116,000 from a special education program, officials said. The employee, Sandra McMikle, who has worked for the Department of Education for about 25 year..."
https://www.nytimes.com/politics/first-draft/2016/02/07/hillary-clintons-campaign-seeks-to-portray-bernie-sanders-as-a-deceptive-candidate/,Hillary Clinton’s Campaign Seeks to Portray Bernie Sanders as a Deceptive Candidate,"As Mr. Sanders returned to the state from an appearance on Saturday Night Live, the Clinton campaign painted him as a high-dollar fund-raiser of lobbyists and as an unethical exploiter of veterans, clergy, union workers and older people."
https://dealbook.nytimes.com/2014/01/28/adding-up-the-costs-of-data-breaches/,Adding Up the Costs of Data Breaches,"Prosecutors often need secrecy to track down those behind cyberattacks, Peter J. Henning writes in his White Collar Watch column. But the need for a company victimized by hacking to disclose information – both to the victims and to shareholders – ..."
https://www.nytimes.com/2006/12/10/weekinreview/10basicsB.html,Why Does Spam Thrive? Easy: It Works,"The gullible and greedy of the world keep “pump and dump” spamming schemes running strong, though that might be about to change."
https://www.nytimes.com/2011/08/30/business/florida-men-accused-of-22-million-ponzi-scheme.html,2 in Florida Are Charged In $22 Million Ponzi Scheme,"James D. Risher and Daniel Sebastian fraudulently promised annual returns of as much as 124 percent, the S.E.C. said in a lawsuit."
https://artsbeat.blogs.nytimes.com/2015/12/30/police-say-rome-airport-workers-ran-art-theft-ring/,Police Say Rome Airport Workers Ran Art-Theft Ring,The Italian police say that workers at the Fiumicino airport in Rome tricked passengers out of valuable artworks
https://artsbeat.blogs.nytimes.com/2012/06/29/book-review-podcast-an-early-practitioner-of-the-ponzi-scheme/,Book Review Podcast: An Early Practitioner of the Ponzi Scheme,The historian Geoffrey Ward tells the story of his great-grandfather’s notorious life in “A Disposition to Be Rich.”
https://www.nytimes.com/2009/03/31/business/global/31fobriefs-CITIFINEDINL_BRF.html,Greece: Citi Fined in Lehman Case,"Greece fined Citigroup $1.3 million, accusing it of misleading investors in the sale of a string of Lehman Brothers financial products."
