url,title,summary
https://bits.blogs.nytimes.com/2015/08/12/when-online-loan-applications-lead-to-unauthorized-bank-account-debits/,When Online Loan Applications Lead to Unauthorized Bank Account Debits,Federal regulators charged two data brokers with illegally selling consumers’ loan applications to nonlenders that used the sensitive financial information to commit fraud.
https://www.nytimes.com/2003/08/16/business/dana-accuses-suitor-of-violating-pact.html,Dana Accuses Suitor Of Violating Pact,Auto parts maker Dana Corp files lawsuit against rival ArvinMeritor Corp in move to block ArvinMeritor's $15-per-share hostile takeover bid; Dana contends ArvinMeritor violated agreement by relying on confidential information it received from Dana...
https://www.nytimes.com/2007/12/14/world/14briefs-oil.html,Probation for Trader in Oil-for-Food Fraud,"Ludmil Dionissiev, an oil trader, was sentenced in New York to two years of probation and a $5,000 fine for his role in a conspiracy to defraud the United Nations oil-for-food program."
https://www.nytimes.com/2002/01/20/business/executive-life-the-boss-in-shock-and-in-charge.html,"In Shock, and in Charge","Fran Keeth, president of Shell Chemical LP, writes The Boss column, telling how she took charge of Shell Oil's tax and finance department in 1970's, when she was in her 20's, only woman and most junior staff member; photo (M)"
https://www.nytimes.com/2000/09/10/travel/practical-traveler-a-boom-market-in-travel-scams.html,A Boom Market In Travel Scams,"David Cay Johnston Practical Traveler column on travel frauds, in light of Federal Trade Commission's announcement of third round of enforcement actions since 1997 against deceptive travel industry practices; describes some popular ruses and tips ..."
/city/kolkata/kolkata-former-bank-manager-held-for-loan-fraud/articleshow/74374204.cms,Kolkata: Former bank manager held for loan fraud,"Probing into a case of bank loan fraud after the subsequent arrest of an assistant manager of a nationalised bank, officers of Bidhannagar Commissionerate has unearthed a gang of bank officials, brokers and fake loan applicants who have been supplying fake documents to banks and taking credits without repaying them for the past three years."
https://www.nytimes.com/2020/06/15/business/virgin-islands-jeffrey-epstein-bank.html,Virgin Islands Again Questions Epstein Estate Transactions,The attorney general there said her office needed more information about $39 million in transactions involving a small bank set up by Jeffrey Epstein.
https://www.nytimes.com/2008/05/04/business/04view.html,The Case for a Newer Deal,"A New Financial Deal, which may follow this financial crisis, should included the dreaded “R” word — regulation — starting in the mortgage market."
/city/chandigarh/panchkula-ifs-officer-loses-rs-1-2-lakh-in-bank-fraud/articleshow/72973130.cms,Panchkula: IFS officer loses Rs 1.2 lakh in bank fraud,"A fraudster withdrew Rs 1.20 lakh from the bank account of an IFS officer posted as chief conservator of forests, incharge western circle, Haryana."
https://www.nytimes.com/2003/02/21/nyregion/6-are-charged-with-selling-millions-of-counterfeit-marlboros.html,6 Are Charged With Selling Millions of Counterfeit Marlboros,"Federal prosecutors in Brooklyn charge six men with smuggling millions of counterfeit Marlboro cigarettes from China and selling them through tax-free businesses at Seneca Indian reservation near Buffalo, NY (M)"
/city/kanpur/5-held-for-fleecing-banks-in-atm-fraud/articleshow/70795833.cms,Five held in Kanpur for fleecing banks in ATM fraud,"Five youths arrested in Kanpur on Wednesday for ATM fraud, revealed on Thursday that they had duped various banks of millions by manipulating ATM cash transactions."
https://www.nytimes.com/2005/06/21/business/front page/extent-of-new-breach-unclear.html,Extent of New Breach Unclear,The largest credit card issuers were still uncertain which customer accounts had been affected by a computer security breach reported by MasterCard. Page C4.
https://artsbeat.blogs.nytimes.com/2009/09/24/magritte-painting-stolen/,Magritte Painting Stolen,A painting by Rene Magritte was stolen from a Brussels museum on Thursday morning by two armed men.
https://www.nytimes.com/2000/01/29/world/ex-yeltsin-aide-denies-reports-in-swiss-money-laundering-case.html,Ex-Yeltsin Aide Denies Reports In Swiss Money-Laundering Case,"Pavel P Borodin, a senior aide to former Pres Boris N Yeltsin, denies charges by Swiss investigators that he engaged in money-laundering and says he will face questioning in Switzerland if asked; Russian prosecutors cast doubt on nature of charges..."
https://www.nytimes.com/2009/09/08/world/europe/08briefs-Bulgaria.html,Bulgaria: Europe Approves Farm Aid,The European Union agreed to release millions of dollars in farm aid to Bulgaria after ruling that Bulgaria had put in place financial controls to guard against fraud and corruption.
https://dealbook.nytimes.com/2010/09/29/hevesi-is-expected-to-plead-guilty-in-pension-case/,Hevesi is Expected to Plead Guilty in Pension Case,"Alan G. Hevesi, the former state comptroller, is poised to plead guilty to a felony corruption charge after a lengthy investigation into his office’s rewarding of pension investment business to investment firms that provided financial benefits to ..."
https://www.nytimes.com/2000/08/03/us/jury-finds-texas-family-was-defrauded-on-oil.html,Jury Finds Texas Family Was Defrauded on Oil,Texas jury finds Gilbert Kerlin defrauded several hundred relatives of 19th-century priest Nicolas Balli and his nephew Juan Jose Balli and now owes them millions of dollars in oil royalties he promised them when he began acquiring title to their ...
https://www.nytimes.com/2006/06/23/nyregion/for-dealer-stolen-maps-point-way-to-jail.html,"For Dealer, Stolen Maps Point Way to Jail","Map dealer Edward Forbes Smiley III pleads guilty in federal and state courts in New Haven, Conn, to stealing 97 antique maps worth more than $3 million from Yale and more than half-dozen universities and libraries over last seven and a half years..."
https://www.nytimes.com/2009/02/22/opinion/22sun1.html,The Government and the Banks,"Though taking over failed banks will be very difficult politically, it could be easier than the elaborate rescue plans that have been tried and proposed."
https://dealbook.nytimes.com/2012/04/17/senate-banking-committee-to-hold-mf-global-hearing/,Senate Banking Committee to Hold MF Global Hearing,"Louis Freeh, who is charged with the job of returning assets to MF Global’s creditors, is expected to testify alongside regulators, as well as another trustee tasked with returning money to customers."
https://www.nytimes.com/2019/02/22/business/mufg-bank-japan-money-laundering.html,U.S. Regulator Warns Japan’s Biggest Bank Again on Money Laundering,The Office of the Comptroller of the Currency said Mitsubishi-UFJ Group had not yet fixed its long-running inability to weed out illegal transactions at some of its branches.
https://www.nytimes.com/2008/09/29/arts/design/29arts-ARENOIRISREC_BRF.html,A Renoir Is Recovered,"Italian police have recovered a Renoir painting that was stolen from a private collection 33 years ago, Agence France-Presse reported."
https://dealbook.nytimes.com/2013/03/11/oppenheimer-settles-s-e-c-s-accusations-it-misled-investors/,Oppenheimer Settles S.E.C.’s Accusations It Misled Investors,The S.E.C. said that Oppenheimer had inflated the value of the largest investment in its fund. The false valuation raised the fund’s internal rate of return.
https://thecaucus.blogs.nytimes.com/2008/10/07/norman-hsu-tied-to-ponzi-scheme/,Norman Hsu Tied to Ponzi Scheme,A scandal-tarred donor is linked to more misdeeds
https://www.nytimes.com/2017/01/27/nyregion/hamilton-ponzi-scheme.html,2 Charged in Ponzi Scheme Built Around ‘Hamilton’ Tickets,The Securities and Exchange Commission accuses two men of luring clients by promising to buy and resell tickets to high-profile events.
https://www.nytimes.com/2010/11/07/us/07breach.html,U.S. Workers Are on Alert After Breach of Data,An employee of the General Services Administration sent the names and Social Security numbers of the agency’s entire staff to a private e-mail address.
https://www.nytimes.com/2012/09/30/automobiles/on-an-electric-highway-charging-into-the-future.html,Charging Ahead on an Electric Highway,"Can you take an electric car on a road trip? To find out, a reporter drives the Model S on a 530-mile journey through California, stopping at Tesla’s Supercharger stations for fill-ups along the way."
https://www.nytimes.com/2017/09/19/sports/football/nfl-concussion-settlement.html,Widespread Deceptive Practices May Reduce Payouts in N.F.L. Concussion Settlement,"“We don’t want to watch these awards be cannibalized,” a lawyer for retired players told a judge investigating lenders and others seeking a cut of payments."
https://www.nytimes.com/2020/02/26/us/columbia-gas-massachusetts.html,Massachusetts Gas Company to Plead Guilty After Fatal Explosion,"Columbia Gas has agreed to sell its business in the state and pay a $53 million fine, the authorities said."
/city/mumbai/maharashtra-2-pmc-bank-auditors-sent-to-police-custody-till-november-15/articleshow/72031208.cms,Maharashtra: 2 PMC Bank auditors sent to police custody till November 15,"The number of arrests in the case has gone up to seven.EOW had arrested HDIL father-son directors Rakesh and Sarang Wadhawan, and the bank's ex-chairman, Waryam Singh and bank's ex-MD Joy Thomas among others."
https://bits.blogs.nytimes.com/2011/09/21/poker-site-fires-back-over-ponzi-scheme-charge/,Poker Site Fires Back Over ‘Ponzi Scheme’ Charge,Prosecutors are throwing the book at Full Tilt Poker. A lawyer for the embattled online poker company is throwing a book back: the dictionary.
https://www.nytimes.com/2001/05/11/nyregion/metro-briefing-new-york-manhattan-theft-ring-alleged.html,Metro Briefing | New York: Manhattan: Theft Ring Alleged,Ten men are accused in federal indictment in New York of stealing luxury cars worth millions of dollars and shipping cars from New York to Russia (S)
https://cityroom.blogs.nytimes.com/2011/12/20/a-sentence-for-stealing-from-bloomberg-that-doesnt-compute/,A Sentence for Stealing From Bloomberg That Doesn’t Compute,"John F. Haggerty Jr., found guilty of stealing campaign money from Mayor Michael R. Bloomberg, $750,000 worth, and sentenced to serve one and a third to four years in prison,  is being treated far more harshly than the despised Bernard L. Madoff."
https://www.nytimes.com/2009/11/06/business/global/06ubs.html,UBS Fined $13.3 Million for Illicit Trades by Employees,Four employees at a bank unit in London had carried out unauthorized trading on at least 39 accounts.
https://krugman.blogs.nytimes.com/2013/07/19/chinas-ponzi-bicycle-is-running-into-a-brick-wall/,China’s Ponzi Bicycle Is Running Into A Brick Wall,And the jackboot is thrown into the melting pot.
https://www.nytimes.com/2018/09/19/business/danske-bank-money-laundering.html,Danske Bank Says Billions May Have Been Laundered at Single Branch,The Danish lender published a report saying its branch in Estonia had failed for years to stop suspected money laundering potentially involving thousands of customers.
https://www.nytimes.com/2002/11/14/business/retailers-suit-says-2-issuers-of-debit-cards-broke-law.html,Retailers' Suit Says 2 Issuers Of Debit Cards Broke Law,Class-action lawsuit brought on behalf of five million retail merchants accuses Visa International and MasterCard International of colluding to monopolize market for debit cards; charge issuers with designing their debit cards to be virtually indi...
https://dealbook.nytimes.com/2006/05/09/ex-gemstar-chief-is-ordered-to-pay-22-million-for-role-in-fraud/,Ex-Gemstar Chief Is Ordered to Pay $22 Million for Role in Fraud,"A federal court yesterday ordered Henry C. Yuen, former chief executive of Gemstar-TV Guide International, to pay $22 million for his role in a scheme to defraud investors by inflating the company’s revenue, regulators said."
https://dealbook.nytimes.com/2010/04/22/panel-subpoenas-documents-of-moodys/,Panel Subpoenas Moody’s Documents,A federal panel said Wednesday that it had issued a subpoena to the credit-rating agency Moody’s Investors Service after the company failed to promptly respond to its request for documents and e-mail messages.
https://www.nytimes.com/2001/02/13/us/scams-point-the-desperate-to-nonexistent-assistance.html,Scams Point the Desperate To Nonexistent Assistance,"Growing number of mail-order businesses are selling false hopes of free money to desperate people; they sell lists of foundations, most of which either make no grants to individuals, or do so only in carefully restricted programs; mail-order busin..."
https://www.nytimes.com/2008/07/06/business/06metrics.html,Cashing In on Obama and McCain,Nearly half of the $900 million the presidential candidates have spent on their campaigns has been paid to just a few dozen companies.
https://www.nytimes.com/2013/02/12/us/politics/jim-greer-of-fla-gop-pleads-guilty-to-theft.html,G.O.P. Chief in Florida Pleads Guilty,"Jim Greer, the former party chairman in Florida, was charged with steering $125,000 in party money into his personal bank accounts."
/city/mumbai/third-auditor-held-in-bank-fraud-case/articleshow/72044539.cms,Third auditor held in PMC Bank fraud case,"The economic offences wing (EOW) probing the Rs 6,500 crore PMC Bank loan fraud arrested the third auditor in the case on Tuesday."
https://www.nytimes.com/2007/09/17/world/17cnd-nations.html,Countries to Get Help Recovering Stolen Assets,The World Bank and the United Nations are creating a system to help track assets stolen by corrupt leaders.
/city/kolkata/crime-map-widens-as-more-skimming-complaints-pour-in/articleshow/72374307.cms,Kolkata: Crime map widens as more skimming complaints pour in,"City cops have started a joint combing operation in collaboration with Delhi Police in the southern and eastern pockets of the Capital after specific inputs on the movement of three suspects involved in the ATM skimming racket, top Lalbazar officers told TOI on Wednesday. The operations are largely concentrated on hotels, guesthouses and certain buildings that have been rented out to foreigners. All possible CCTV footage are being scanned."
https://dealbook.nytimes.com/2009/06/02/kmart-confidential-jury-finds-ex-ceo-liable/,Kmart Confidential: Jury Finds ex-C.E.O. Liable,"A federal jury on Monday found the former chief executive of Kmart, Charles C. Conaway, liable for misleading investors about the company’s cash crisis in the months before its 2002 bankruptcy."
https://www.nytimes.com/2019/09/27/smarter-living/wirecutter/no-wallet-digital-payments.html,How I Survived a Week Without My Wallet,It’s possible (though not always painless) to live without a wallet — as long as you have a smartphone.
https://dealbook.nytimes.com/2009/02/04/ponzi-scheme-hits-missouri-investors/,Ponzi Scheme Hits Missouri Investors,"The president of Rate Search, a Missouri investment firm, has pleaded guilty to fraud and tax charges involving a $4.5 million Ponzi scheme, The St. Louis Business Journal reported."
https://www.nytimes.com/2020/02/05/us/john-davis-mdhs-brett-dibiase.html,Former Mississippi Welfare Director Charged With Embezzling Millions,"John Davis, who last year retired from the Department of Human Services, used some of the funds to pay for Brett DiBiase, a former professional wrestler, to go to drug rehab, the state auditor said."
https://bits.blogs.nytimes.com/2012/01/12/malicious-software-attacks-security-cards-used-by-pentagon/,Malicious Software Attacks Security Cards Used by Pentagon,"Chinese hackers have deployed a new cyber weapon that is aimed at the federal agencies and United States  businesses, security researchers say."
https://www.nytimes.com/2001/07/20/nyregion/indictments-charge-4-racetrack-tellers-with-laundering-money-at-betting-windows.html,Indictments Charge 4 Racetrack Tellers With Laundering Money at Betting Windows,"Indictments are issued against four tellers, Robert E Lodati, Robert J Marshall, Joseph Rabito and Pete Oster, who work at Belmont, Aqueduct and Saratoga racetracks charging them with laundering money; charges arise from sting operation conducted ..."
https://www.nytimes.com/2005/08/16/business/4-exbrokers-are-accused-of-conspiracy.html,4 Ex-Brokers Are Accused of Conspiracy,"Four former stockbrokers at major securities firms were accused yesterday of conspiring with day traders who wanted to eavesdrop on customer order information to make easy profits.     In separate actions yesterday, the Justice Department and the ..."
https://bucks.blogs.nytimes.com/2012/10/24/keeping-cash-on-hand-just-in-case/,"Keeping Cash on Hand, Just in Case","The recent cyberattacks on big American banks raise the question: Is it a good idea to hide some cash at home, just in case?"
https://www.nytimes.com/2012/03/31/business/mastercard-and-visa-look-into-possible-attack.html,MasterCard and Visa Investigate Data Breach,An intrusion at a third-party vendor may have exposed cardholders’ personal information.
https://www.nytimes.com/2013/07/30/nyregion/man-pleads-guilty-in-plot-to-defraud-broadway-producers.html,Man Pleads Guilty in Plot to Defraud Broadway Producers,A former stockbroker admitted he invented investors and a phantom loan as part of a sham effort to rescue a failed production of “Rebecca.”
https://www.nytimes.com/2019/04/17/us/politics/made-in-america-ftc-trump.html,"On ‘Made in America,’ Trump’s F.T.C. Appointees May Be Out of Step With Him","Democrats on the Federal Trade Commission want to penalize companies that falsely market products as American made, but the president’s appointees reject that approach."
https://www.nytimes.com/2017/03/15/arts/design/shadow-of-old-masters-forgeries-hangs-over-an-art-fair.html,Shadow of Old Masters’ Forgeries Hangs Over an Art Fair,Four galleries at Tefaf Maastricht have open legal cases involving artworks deemed by other experts to be forgeries.
/business/india-business/banks-issue-gag-orders-to-employees-over-branch-overcrowding-report/articleshow/75148043.cms,Banks issue gag orders to employees over branch overcrowding: Report,"State-owned banks have barred employees from posting pictures, video clips or messages on social media on issues such as overcrowding at bank branches during the coronavirus crisis, according to multiple sources and documents seen by Reuters."
https://www.nytimes.com/2020/01/27/opinion/trump-obstruction-impeachment.html,This Question Is More Important Than Removing Trump,Can a sitting president block witnesses at his own impeachment trial?
https://www.nytimes.com/2010/11/10/nyregion/10holocaust.html,U.S. Says Holocaust Fund Was Defrauded,Fake documents and a knowledge of Holocaust history were used to defraud a fund of more than $42 million.
https://www.nytimes.com/2012/07/21/business/ex-bank-of-america-official-indicted-in-muni-bid-rigging.html,Ex-Bank of America Official Indicted in Muni Bid-Rigging,"Phillip Murphy, former head of the bank’s municipal derivatives desk, was charged with conspiracy to defraud the United States, wire fraud and conspiracy to make false entries in bank records."
https://www.nytimes.com/2003/10/24/us/national-briefing-midwest-indiana-faked-cancer-leads-to-charges.html,National Briefing | Midwest: Indiana: Faked Cancer Leads To Charges,Former Ball State University student Brookelyn Walters is charged by Indiana prosecutors with forgery and theft for bilking sympathetic students by pretending to have cancer for three years (S)
https://www.nytimes.com/video/business/100000000814481/guilty-verdict-in-galleon-trial.html,Guilty Verdict in Galleon Trial,"Raj Rajaratnam, the billionaire co-founder of the hedge fund Galleon Group, was found guilty on 14 counts of securities fraud and conspiracy today in federal court in Manhattan."
https://www.nytimes.com/2019/09/22/business/ponzi-scheme-bernie-madoff.html,"In the Decade Since Madoff, Ponzi Schemers Try New Tactics",The S.E.C. has prosecuted 50 percent more Ponzi cases in the last 10 years. Those scams cost their victims $31 billion.
https://dealbook.nytimes.com/2010/09/23/timing-of-goldman-case-suspicious-watchdog-says/,"Timing of Goldman Case ‘Suspicious,’ Watchdog Says","The timing of the Securities and Exchange Commission’s case against Goldman Sachs is “suspicious,” a federal watchdog said, suggesting that the S.E.C. used it to divert attention from a report that sharply criticized its probe into R. Allen Stanfo..."
https://www.nytimes.com/2017/01/19/nyregion/gold-flake-theft-robbery.html,Suspect in Theft of Bucket of Gold Flakes Is Caught in Ecuador,"Julio Nivelo was arrested in his native country, the New York police said. The fate of the scraps, stolen in Manhattan and valued at $1.6 million, was unknown."
https://economix.blogs.nytimes.com/2006/12/28/which-options-disclosure-is-more-misleading/,Which Options Disclosure Is More Misleading?,S.E.C. Chairman Christopher Cox defends his new rule on disclosing stock options.
https://www.nytimes.com/2020/05/26/business/economy/uber-drivers-unemployment-benefits.html,Uber and Lyft Drivers Sue for New York Unemployment Benefits,"In the latest challenge over their labor status, gig workers say the state is illegally failing to pay them jobless benefits in a timely way."
https://www.nytimes.com/2011/12/09/business/deep-roots-of-fraud-at-olympus.html,Deep Roots of Fraud at Olympus,"The depreciation of the dollar in 1985 started a series of events that led to fraud at the Olympus Corporation, which was later uncovered because of accounting reforms caused by the Enron scandal."
https://www.nytimes.com/2017/09/18/business/equifax-breach-federal-investigation.html,Prosecutors Open Criminal Investigation Into Equifax Breach,Federal prosecutors and the F.B.I. are investigating a cyberattack that potentially exposed personal data on 143 million Americans.
https://www.nytimes.com/2007/05/04/business/worldbusiness/04fobriefs-LIMITSONCELL_BRF.html,Europe: Limits on Cellphone Charges Advance,"Negotiators for the European Parliament, the European Commission and the European Union’s telecommunications ministers agreed to a compromise that could limit mobile phone roaming charges for 450 million European consumers by the end of the summer..."
https://www.nytimes.com/2007/03/16/opinion/16fri1.html,Phony Fraud Charges,"The accusation that United States attorneys were insufficiently aggressive about voter fraud is a way of saying, without actually saying, that they would not use their offices to help Republicans win elections."
https://www.nytimes.com/2005/06/21/business/banks-unsure-which-cards-were-exposed-in-breach.html,Banks Unsure Which Cards Were Exposed in Breach,"Nation's largest issuers of credit cards are still uncertain which customer accounts were affected by computer security breach at CardSystems Solutions, processing company; MasterCard has said more than 40 million credit card accounts were exposed..."
https://www.nytimes.com/2003/05/14/us/multicolored-20-bill-is-coming-in-the-fall.html,Multicolored $20 Bill Is Coming in the Fall,"US currency is being redesigned to deter counterfeiting, and new bills will include colors other than standard black and green; first new bill, due out this tall, will be $20 bill, most frequently counterfeited note; photo (M)"
/india/acb-smells-political-patronage-in-jk-bank-fraud-case-raids-continue/articleshow/69748836.cms,"ACB smells political patronage in J&K Bank fraud case, raids continue",The decisions under scrutiny relate to Parvez Ahmad Negroo's tenure as J&K Bank chairman and are being probed under the Prevention of Corruption Act as per an FIR registered on June 8.
https://dealbook.nytimes.com/2007/02/21/justices-reject-antitrust-award/,Justices Reject Antitrust Award,"The Supreme Court threw out a $79 million award against Weyerhaeuser on Tuesday in a lawsuit accusing the company of trying to monopolize the hardwood lumber market in the Pacific Northwest. The decision, which was unanimous, came in the case of a defunct lumber mill that said it was driven out of business when Weyerhaeuser overpaid for logs that it allegedly did not need."
https://cityroom.blogs.nytimes.com/2009/08/20/3-businesses-accused-of-defrauding-immigrants/,3 Businesses Accused of Defrauding Immigrants,"Three other companies are permanently banned from immigration-related services and will collectively pay about $118,000 in penalties."
https://www.nytimes.com/2017/02/25/world/asia/north-korea-kim-jong-nam-vx-nerve-agent-siti-aisyah.html,Woman Held in Death of North Korean Leader’s Kin Says She Was Duped,Siti Aisyah said she was paid by foreign men for what she thought was a prank for a television show and did not know that anyone would be harmed.
https://www.nytimes.com/2009/01/07/business/07tax.html,"For Victims of Schemes, the I.R.S. Can Be Flexible","Under U.S. tax rules, investors may be able to seek redress from the federal government for losses stemming from the $50 billion Ponzi scheme that Bernard L. Madoff is suspected of orchestrating, tax experts say."
https://www.nytimes.com/2017/01/18/business/dealbook/student-loans-navient-lawsuit.html,"Student Loan Collector Cheated Millions, Lawsuits Say","Navient made serious mistakes at every step of the loan collection process, the Consumer Financial Protection Bureau said in a lawsuit."
https://www.nytimes.com/2007/10/16/washington/16scotus.html,Justices to Hear Challenge to Money-Laundering Law,The Supreme Court agreed on Monday to decide whether hiding the proceeds of an illegal activity can be prosecuted as money laundering under federal law.
